{
  "id": "missing_transition_outputs",
  "family": "bugfix",
  "category": "comparator",
  "domain": "voltage",
  "difficulty": "easy",
  "expected_backend": "evas",
  "must_include": ["transition(", "electrical"],
  "must_not_include": ["I(", "ddt("],
  "inputs": ["prompt.md"],
  "artifacts": ["dut_fixed.va"],
  "scoring": ["dut_compile", "tb_compile", "sim_correct"]
}
